{
  "schema_version": "inferential_safety_lab.config.v1",
  "scenario_id": "MCAR_SMALL_EFFECTIVE_SAMPLE",
  "sample_size": 150,
  "tau": 0.25,
  "repetitions": 160,
  "master_seed": 2026081701,
  "missingness_rate": 0.60,
  "contamination_fraction": 0.05,
  "contamination_displacement": 8.0,
  "confidence_level": 0.95,
  "winsorization_limits": [-3.0, 3.0]
}
